title,year,venue_or_source,ccf_a_status,paper_link,code_or_data_link,code_status,data_collectability,gpu_or_hardware,workflow,innovation_or_threat,evaluation,fit_to_a2,recommendation,notes
"ClearGrasp: 3D Shape Estimation of Transparent Objects for Manipulation","2020","ICRA / arXiv","robot venue, not counted as CCF-A here","https://arxiv.org/abs/1910.02550","https://github.com/Shreeyak/cleargrasp","official code, data, checkpoints","high; public synthetic train and real/synthetic val-test, RealSense demo","Ubuntu16/PyTorch1.3/CUDA9; GPU model not reported","RGB-D, transparent mask, normals, occlusion boundaries, global depth optimization","classic transparent-object RGB-D depth completion and manipulation baseline","depth completion metrics, suction and parallel-jaw manipulation","L1 post-hoc baseline and related-work anchor","must-read background","Do not claim transparent depth correction itself as novelty."
"RGB-D Local Implicit Function for Depth Completion of Transparent Objects","2021","CVPR","CCF-A confirmed","https://arxiv.org/abs/2104.00622","https://github.com/NVlabs/implicit_depth","official code and checkpoints","medium; ClearGrasp plus Omniverse Object Dataset","4x Tesla V100 32GB, CUDA10.2, PyTorch1.6","RGB-D local implicit function, refinement, hard-negative mining","strong local depth-completion baseline","ClearGrasp/Omniverse transparent depth completion","L1 local/post-hoc completion threshold","strong follow-up","Environment is old and multi-GPU; reproduction cost medium-high."
"TransCG: A Large-Scale Real-World Dataset for Transparent Object Depth Completion and a Grasping Baseline","2022","IEEE RA-L / ICRA","robot journal/conference","https://arxiv.org/abs/2202.08471","https://github.com/Galaxies99/TransCG; https://graspnet.net/transcg","official code, dataset, checkpoint","high; 57,715 real RGB-D images, 51 transparent objects, 130 scenes","RTX 3090, CUDA11.1, PyTorch1.9 in README","RGB-D depth completion with DFNet and grasping baseline","primary real transparent-grasping dataset and baseline","TransCG/ClearGrasp/Omniverse plus grasping demo","first offline transparent failure-slice dataset","strong follow-up","Best starting point for transparent-mask/no-anchor metrics."
"ClearPose: Large-scale Transparent Object Dataset and Benchmark","2022","ECCV","not counted as CCF-A here","https://arxiv.org/abs/2203.03890","https://github.com/opipari/ClearPose","official dataset and benchmark branches","high; RGB, raw depth, rendered true depth, normals, 6D pose, adversarial splits","not reported as unified GPU cost","dataset and benchmark for depth completion and pose estimation","transparent object benchmark with occlusion/liquid/non-planar/translucent-cover splits","depth completion and pose benchmark","external generalization and adversarial slice","strong data resource","Useful after TransCG to avoid overfitting one dataset."
"DREDS / SwinDRNet","2022","ECCV","not counted as CCF-A here","https://arxiv.org/abs/2208.03792","https://github.com/PKU-EPIC/DREDS","official code, data, simulator, weights","medium-high; DREDS synthetic 130k and STD real 38k, non-commercial","GPU not reported in README","domain-randomized depth simulation, RGB-D restoration, SwinDRNet","sim2real restoration threat for specular/transparent objects","real RGB-D, pose estimation, grasping","strong sim2real/data-route threat","strong follow-up","A2 should not pretend data-driven restoration is missing."
"Booster: A Benchmark for Depth from Images of Specular and Transparent Surfaces","2023","benchmark / arXiv, CVPR workshop ecosystem","resource/challenge","https://arxiv.org/abs/2301.08245","https://cvlab-unibo.github.io/booster-web/","dataset and challenge data","high; high-res stereo/mono, material masks, ToM class, challenge splits","not reported","high-resolution non-Lambertian monocular/stereo depth benchmark","protocol and failure-slice resource","Booster benchmark, NTIRE/TRICKY challenges","metric-vs-affine protocol and ToM mask evaluation","strong protocol resource","NTIRE 2026 mono uses metric depth in cm; important for A2."
"Learning Depth Estimation for Transparent and Mirror Surfaces / Depth4ToM","2023","ICCV","CCF-A confirmed","https://arxiv.org/abs/2307.15052","https://github.com/CVLAB-Unibo/Depth4ToM-code","official code, data, weights; stereo training code partially withheld","high; Trans10K/MSD virtual depths and Booster","GPU not reported","inpainting ToM regions, MDE/stereo pseudo labels, fine-tuning","training/pseudo-label route for ToM MDE","Booster and ToM data","threat to generic transparent MDE adaptation; contrast with A2 training-free/sampling-time route","strong follow-up","Must cite if A2 evaluates Booster ToM surfaces."
"ASGrasp: Generalizable Transparent Object Reconstruction and 6-DoF Grasp Detection from RGB-D Active Stereo Camera","2024","ICRA","robot venue","https://arxiv.org/abs/2405.05648","https://github.com/jun7-shi/ASGrasp","official code and checkpoints","medium; active stereo, MVS, GSNet/GraspNet dependencies","Python3.8/PyTorch1.9.1/CUDA11.1; GPU model not reported","active stereo reconstruction and 6-DoF grasp detection","sensor/system upper bound for transparent grasping","transparent reconstruction and grasp detection","deployment upper bound, not equal-input baseline","observable strong system","Use to state A2 is low-cost/sparse-anchor setting, not replacing active stereo."
"Towards Robust Monocular Depth Estimation in Non-Lambertian Surfaces","2024","arXiv","not accepted/venue待核验","https://arxiv.org/abs/2408.06083","code not verified","not verified","medium; non-Lambertian datasets need checking","not reported","region-guided training and augmentation for non-Lambertian MDE","training-based MDE adaptation threat","transparent/mirror/non-Lambertian evaluation","related threat, not first reproduction candidate","observe","Keep as warning against claiming ToM MDE adaptation is new."
"ClearDepth: Enhanced Stereo Perception of Transparent Objects for Robotic Manipulation","2024","arXiv / project","venue待核验","https://arxiv.org/abs/2409.08926","code not found in this pass","not found","medium; stereo/sim2real data path needs checking","not reported","stereo ViT and sim2real transparent-object perception","stereo/sensor-route threat","transparent robotic manipulation","upper-bound/reference for stronger sensing","observe","Not first-line A2 baseline unless code appears."
"MODEST: Monocular Depth Estimation and Segmentation for Transparent Object with Iterative Semantic and Geometric Fusion","2025","ICRA / arXiv","robot venue / arXiv","https://arxiv.org/abs/2502.14616","https://github.com/D-Robotics-AI-Lab/MODEST","official code and weights","high; Syn-TODD and ClearPose","RTX 4090 tested environment, Python3.8, CUDA11.1","single RGB segmentation-depth joint learning, iterative semantic/geometric fusion","direct single-RGB transparent depth and segmentation threat","Syn-TODD and ClearPose","if A2 uses masks or semantic priors, must compare or account for mask cost","strong follow-up","A2 should include mask-free/noisy-mask ablation if using masks."
"Seeing and Seeing Through the Glass / LayeredDepth","2025","ICCV / arXiv","ICCV strong related","https://arxiv.org/abs/2503.11633","https://github.com/princeton-vl/LayeredDepth; https://huggingface.co/datasets/princeton-vl/LayeredDepth","official code and data","medium; benchmark public, synthetic generator needs custom Blender/Infinigen","not reported","real and synthetic multi-layer transparent depth benchmark","conceptual challenge to single-layer depth","LayeredDepth validation/test server","claim-boundary resource for contact/front/grasp-relevant surface","strong follow-up","A2 must not claim complete optical reconstruction."
"Monocular One-Shot Metric-Depth Alignment for RGB-Based Robot Grasping / MOMA","2025","arXiv","not accepted/venue待核验","https://arxiv.org/abs/2506.17110","https://github.com/GreatenAnoymous/MOMA","code entry exists, README short","medium; UR5 and sparse GT depth calibration needed for full reproduction","paper page reports RTX 3090 real-time inference; training cost not reported","single RGB MDE, scale-rotation-shift sparse calibration, robot grasp/suction","closest sparse metric alignment threat","UR5 robot grasping including transparent objects","must be L1 post-hoc/SRS comparison","highest priority threat","Most important novelty pressure for A2 transparent route."
"Rethinking Transparent Object Grasping: Depth Completion with Monocular Depth Estimation and Instance Mask / ReMake","2026","IEEE RA-L","robot journal","https://arxiv.org/abs/2508.02507","https://github.com/ChengYaofeng/ReMake","official code, checkpoint, train/test/inference scripts","high; ClearGrasp, TransCG, OOD data links","1x RTX3090 80h or 8x RTX3090 10h in README","instance mask, MDE relative depth, original depth, RGB-D completion","direct transparent grasping MDE+mask threat","ClearGrasp, TransCG, OOD, real-world inference/grasping","strong baseline if A2 enters transparent grasping","strong follow-up","Count mask/MDE/completion modules in nfe_real or system cost."
"SeeClear: Reliable Transparent Object Depth Estimation via Generative Opacification","2026","arXiv","not accepted/venue待核验","https://arxiv.org/abs/2603.19547","https://github.com/YumengHe/SeeClear","code-only; pretrained models and dataset coming soon","medium-low today; SeeClear-396k not yet released in README","paper reports 4x H100 NVL about 30h","mask preparation, conditional diffusion opacification, mask refinement, DA3/MoGe depth","generative opacification threat","transparent-object depth estimation with off-the-shelf MDE","strong observation; do not duplicate opacification-only idea","observe strongly","Revisit when weights/data are released."
"SeeGroup: Multi-Layer Depth Estimation of Transparent Surfaces via Self-Determined Grouping","2026","CVPR Oral / arXiv","CCF-A confirmed","https://arxiv.org/abs/2605.28735","https://github.com/princeton-vl/SeeGroup","official code and checkpoint","medium; LayeredDepth data needed","single/multi-GPU supported; GPU model/time not reported","unordered point-process multi-layer depth, permutation-invariant likelihood","strong multi-layer depth threat","LayeredDepth; repo reports 61.34 to 70.09 quadruplet accuracy improvement","conceptual boundary for A2 single-layer metric depth","strong follow-up","Limit A2 output to contact/front/grasp-relevant surface."
"AISPO: Enhancing Depth Reliability for Robotic Manipulation of Non-Lambertian Objects via Affine-Invariant Shape Prior","2026","IEEE RA-L forthcoming / arXiv","robot journal","https://arxiv.org/abs/2606.25503","code not found","not found","medium; paper available, reproduction blocked by code","paper page reports 8x A100 training and RTX3090 evaluation","affine-invariant shape prior for non-Lambertian depth reliability","very close affine-prior and physical-depth threat","non-Lambertian robotic manipulation","strong reviewer threat; monitor code","observe strongly","Do not ignore in related work even without code."
"Robotic Perception of Transparent Objects: A Review","2024","IEEE TAI / arXiv","survey","https://arxiv.org/abs/2304.00157","N/A","survey","high as reading material","N/A","survey of transparent-object robotic perception","problem taxonomy and reviewer-threat map","survey","writing background","background","Use for related-work organization."
"Survey on Monocular Metric Depth Estimation","2025","arXiv survey","survey","https://arxiv.org/abs/2501.11841","N/A","survey","high as reading material","N/A","survey of metric MDE","metric/affine deployment background","survey","protocol background","background","Use to justify metric-depth framing."
"Seeing Glass: Joint Point Cloud and Depth Completion for Transparent Objects","2021","CoRL / PMLR","robot conference","https://proceedings.mlr.press/v164/xu22b.html","code not emphasized in this pass","not verified","medium","not reported","point cloud and depth completion for transparent objects","RGB-D/point-cloud completion route","transparent depth completion","background/upper baseline","observe","Useful to show joint point-cloud restoration is mature."
"Dex-NeRF: Using a Neural Radiance Field to Grasp Transparent Objects","2022","CoRL / PMLR","robot conference","https://proceedings.mlr.press/v164/ichnowski22a.html","code not emphasized in this pass","not verified","low-medium; multi-view/robot setup heavy","not reported","NeRF-based transparent object grasping","multi-view/active perception upper bound","robot grasping","system upper bound, not equal-input comparison","observe","Use to bound single-image claims."
"Transparent Object Depth Completion","2024","arXiv","venue待核验","https://arxiv.org/abs/2405.15299","code not verified","not verified","medium","not reported","single-view RGB-D completion plus multi-view depth and confidence refinement","multi-view refinement observation","depth completion","observe as adjacent work","observe","Not first-line unless code/data become clear."
"DepthShield Demo","2026","GitHub demo / venue待核验","not verified","https://github.com/SeracoZ/DepthShield","https://github.com/SeracoZ/DepthShield","demo repo","low-medium; demo-level implementation","not reported","mask-aware head plus inference-time Gaussian blur refinement on ToM surfaces","plug-and-play inference-time refinement idea, weak evidence","demo only","observation list","observe","Do not cite as peer-reviewed threat unless venue is verified."
